{
  "$schema": "https://bharatstudio.in/contracts/v1/channel-safety-corpus-term.schema.json",
  "schemaVersion": "v1",
  "termId": "00000000-0000-4000-8000-0000000099a1",
  "scope": "channel",
  "term": "example-term",
  "wholeWord": true,
  "displayDecision": "mask",
  "ttsDecision": "block",
  "moderatorReviewDecision": "hold",
  "createdAt": "2026-09-17T10:00:00.000Z"
}
